Show,Season,Episode
Paw Patrol,Season 1,Pups Make a Splash / Pups Fall Festival
Paw Patrol,Season 1,Pups Save the Sea Turtles / Pups and the Very Big Baby
Paw Patrol,Season 1,Pups and the Kitty-tastrophe / Pups Save a Train
Paw Patrol,Season 1,Pup Pup Boogie / Pups in a Fog
Paw Patrol,Season 1,Pup Pup Goose / Pup Pup and Away
Paw Patrol,Season 1,Pups on Ice / Pups and the Snow Monster
Paw Patrol,Season 1,Pups Save the Circus / Pup A Doodle Doo
Paw Patrol,Season 1,Pups Pit Crew / Pups Fight Fire
Paw Patrol,Season 1,Pups Save the Treats / Pups Get a Lift
Paw Patrol,Season 1,Pups and the Ghost Pirate
Paw Patrol,Season 1,Pups Save Christmas
Paw Patrol,Season 1,Pups Get a Rubble / Pups Save a Walrus
Paw Patrol,Season 1,Pups Save the Bunnies / Pup-Tacular
Paw Patrol,Season 1,Pups Save the Bay / Pups Save a Goodway
Paw Patrol,Season 1,Pups Save a Hoedown / Pups Save Alex
Paw Patrol,Season 1,Pups Save a School Day / Pups Turn on the Lights
Paw Patrol,Season 1,Pups Save a Pool Day / Circus Pup-Formers
Paw Patrol,Season 1,Pups Save the Easter Egg Hunt
Paw Patrol,Season 1,Pups Save a Super Pup / Pups Save Ryder's Robot
Paw Patrol,Season 1,Pups Save a Monkey / Pups Save a Hoot
Paw Patrol,Season 1,Pups Save a Bat / Pups Save a Toof
Paw Patrol,Season 1,Pups Save the Camping Trip / Pups and the Trouble with Turtles
Paw Patrol,Season 1,Pups and the Beanstalk / Pups Save the Turbots
Paw Patrol,Season 1,Pups and the Lighthouse Boogie / Pups Save Ryder
Paw Patrol,Season 1,Pups Great Race / Pups Take the Cake
Paw Patrol,Season 1,Pups and the Pirate Treasure
Paw Patrol,Season 2,Pups Save the Penguins / Pups Save a Dolphin Pup
Paw Patrol,Season 2,Pups Save the Space Alien / Pups Save a Flying Frog
Paw Patrol,Season 2,Pups Save Jake / Pups Save the Parade
Paw Patrol,Season 2,Pups Save the Diving Bell / Pups Save the Beavers
Paw Patrol,Season 2,The New Pup
Paw Patrol,Season 2,Pups Jungle Trouble / Pups Save a Herd
Paw Patrol,Season 2,Pups and the Big Freeze / Pups Save a Basketball Game
Paw Patrol,Season 2,Pups Save an Ace / Pups Save a Wedding
Paw Patrol,Season 2,Pups Save a Talent Show / Pups Save the Corn Roast
Paw Patrol,Season 2,Pups Leave Marshall Home Alone / Pups Save the Deer
Paw Patrol,Season 2,Pups Save the Parrot / Pups Save the Queen Bee
Paw Patrol,Season 2,Pups Save a Mer-Pup
Paw Patrol,Season 2,Pups Save a Ghost / Pups Save a Show
Paw Patrol,Season 2,Pups Save an Elephant Family / Pups and the Mischievous Kittens
Paw Patrol,Season 2,Pups Save a Friend / Pups Save a Stowaway
Paw Patrol,Season 2,Pups' Adventures in Babysitting / Pups Save the Fireworks
Paw Patrol,Season 2,Pups Save a Sniffle/Pups and the Ghost Cabin
Paw Patrol,Season 2,Pups Save an Adventure / Pups Save a Surprise
Paw Patrol,Season 2,Pup-Fu
Paw Patrol,Season 2,Pups Save the Mayor's Race / Pups Save an Outlaw's Loot
Paw Patrol,Season 2,Pups Save Walinda / Pups Save a Big Bone
Paw Patrol,Season 2,Pups Save a Floundering Francois / Pups Save the Pop-Up Penguins
Paw Patrol,Season 2,Pups Save a Snowboard Competition / Pups Save a Chicken of the Sea
Paw Patrol,Season 2,Pups Save a Pizza / Pups Save Skye
Paw Patrol,Season 2,Pups Save the Woof and Roll Show / Pups Save an Eagle
Paw Patrol,Season 2,Pups Bark with Dinosaurs
Paw Patrol,Season 3,Pups Find a Genie / Pups Save a Tightrope Walker
Paw Patrol,Season 3,Pups Save a Goldrush / Pups Save the PAW Patroller
Paw Patrol,Season 3,Pups Save the Soccer Game / Pups Save a Lucky Collar
Paw Patrol,Season 3,Pups Save Alex's Mini-Patrol / Pups Save a Lost Tooth
Paw Patrol,Season 3,Air Pups
Paw Patrol,Season 3,Pups Save Friendship Day
Paw Patrol,Season 3,Pups Save Apollo / Pups Save the Hippos
Paw Patrol,Season 3,"Pups Save Daring Danny X / Pups in a Fix"""
Paw Patrol,Season 3,Pups Save a Dragon / Pups Save Three Little Pigs
Paw Patrol,Season 3,Pups Save a Stinky Flower / Pups Save a Monkey-naut
Paw Patrol,Season 3,Pups Save the Polar Bears / Pup in Sheep's Clothing
Paw Patrol,Season 3,Pups Save a School Bus / Pups Save the Songbirds
Paw Patrol,Season 3,Pups Save Old Trusty / Pups Save a Pony
Paw Patrol,Season 3,Pups Save a Robo-Saurus / Pups Save a Film Festival
Paw Patrol,Season 3,Tracker Joins the Pups!
Paw Patrol,Season 3,Pups Bear-ly Save Danny / Pups Save the Mayor's Tulips
Paw Patrol,Season 3,All Star Pups! / Pups Save Sports Day
Paw Patrol,Season 3,Pups in a Jam / Pups Save a Windsurfing Pig
Paw Patrol,Season 3,Pups Get Growing / Pups Save a Space Toy
Paw Patrol,Season 3,Pups Get Skunked / Pups and a Whale of a Tale
Paw Patrol,Season 3,Parroting Pups / Merpups Save the Turbots
Paw Patrol,Season 3,The Pups' Winter Wonder Show
Paw Patrol,Season 3,Pups Save the Gliding Turbots / Pups Save a Plane
Paw Patrol,Season 3,Pups Save a Giant Plant / Pups Get Stuck
Paw Patrol,Season 3,Pups Raise the PAW Patroller / Pups Save the Crows
Paw Patrol,Season 3,Pups Save Their Floating Friends / Pups Save a Satellite
Paw Patrol,Season 4,Pups Save a Blimp / Pups Save the Chili Cook-Off
Paw Patrol,Season 4,Pups Save a Teeny Penguin / Pups Save the Cat Show
Paw Patrol,Season 4,Pups Save a Playful Dragon / Pups Save the Critters
Paw Patrol,Season 4,Mission PAW: Quest for the Crown
Paw Patrol,Season 4,Pups Save a Sleepover / Pups Save the Carnival
Paw Patrol,Season 4,Pups Save Jake's Cake / Pups Save a Wild Ride
Paw Patrol,Season 4,Mission PAW: Royally Spooked / Pups Save Monkey-dinger
Paw Patrol,Season 4,Pups Save the Flying Food / Pups Save a Ferris Wheel
Paw Patrol,Season 4,Pups Save a Sleepwalking Bear / Pups Save Dude Ranch Danny
Paw Patrol,Season 4,Mission PAW: Pups Save the Royal Throne
Paw Patrol,Season 4,Pups Save Big Hairy / Pups Save a Flying Kitty
Paw Patrol,Season 4,Pups Party with Bats / Pups Save Sensei Yumi
Paw Patrol,Season 4,Sea Patrol: Pups Save a Baby Octopus
Paw Patrol,Season 4,Pups Save the Runaway Kitties / Pups Save Tiny Marshall
Paw Patrol,Season 4,Pups Chill Out / Pups Save Farmer Alex
Paw Patrol,Season 4,Sea Patrol: Pups Save a Shark / Sea Patrol: Pups Save the Pier
Paw Patrol,Season 4,Pups Save a Space Rock / Pups Save a Good Mayor
Paw Patrol,Season 4,Pups Save a City Kitty / Pups Save a Cloud Surfer
Paw Patrol,Season 4,Sea Patrol: Pirate Pups to the Rescue
Paw Patrol,Season 4,Pups Save the Mail / Pups Save a Frog Mayor
Paw Patrol,Season 4,Pups Save the Runaway Turtles / Pups Save the Shivering Sheep
Paw Patrol,Season 4,Sea Patrol: Pups Save a Frozen Flounder / Sea Patrol: Pups Save a Narwhal
Paw Patrol,Season 4,Pups Save Luke Stars / Pups Save Chicken Day
Paw Patrol,Season 4,Pups Save Francois the Penguin / Pups Save Daring Danny's Hippo
Paw Patrol,Season 4,Pups Save Baby Humdinger / Pups Save a Piñata
Paw Patrol,Season 4,Sea Patrol: Pups Save Puplantis
Paw Patrol,Season 5,Pups Save the Kitty Rescue Crew / Pups Save an Ostrich
Paw Patrol,Season 5,Pups Save Big Paw / Pups Save the Hum-Mover
Paw Patrol,Season 5,Sea Patrol: Pups Save a Sunken Sloop / Sea Patrol: Pups Save a Wiggly Whale
Paw Patrol,Season 5,Pups Save a High-Flying Skye / Pups Go for the Gold
Paw Patrol,Season 5,Pups Save an Extreme Lunch / Pups Save a Cat Burglar
Paw Patrol,Season 5,Sea Patrol: Pups Save the Flying Diving Bell / Sea Patrol: Pups Save a Soggy Farm
Paw Patrol,Season 5,Pups Save the Butterflies / Pups Save an Underground Chicken
Paw Patrol,Season 5,Pups Save the Bookmobile / Pups Save Heady Humdinger
Paw Patrol,Season 5,Sea Patrol: Pups Save Their Pirated Sea Patroller
Paw Patrol,Season 5,Pups Save the PawPaws / Pups Save a Popped Top
Paw Patrol,Season 5,Ultimate Rescue: Pups Save the Royal Kitties
Paw Patrol,Season 5,Pups Save the Snowshoeing Goodways / Pups Save a Duck Pond
Paw Patrol,Season 5,Sea Patrol: Pups Save Tilly Turbot / Pups Save an Upset Elephant
Paw Patrol,Season 5,Ultimate Rescue: Pups Save the Tigers
Paw Patrol,Season 5,Rocky Saves Himself / Pups and the Mystery of the Driverless Snow Cat
Paw Patrol,Season 5,Pups Save the Trick-or-Treaters / Pups Save an Out of Control Mini Patrol
Paw Patrol,Season 5,Ultimate Rescue: Pups Save the Movie Monster
Paw Patrol,Season 5,Mission PAW: Pups Save a Royal Concert / Mission PAW: Pups Save the Princess' Pals
Paw Patrol,Season 5,Pups and the Werepuppy / Pups Save a Sleepwalking Mayor
Paw Patrol,Season 5,Ultimate Rescue: Pups Save a Swamp Monster / Ultimate Rescue: Pups and the Hidden Golden Bones
Paw Patrol,Season 5,Pups Save a Cuckoo Clock / Pups Save Ms. Marjorie's House
Paw Patrol,Season 5,Pups Save Thanksgiving / Pups Save a Windy Bay
Paw Patrol,Season 5,Pups Save a Frozen Camp Out / Pups Save the Fizzy Pickles
Paw Patrol,Season 5,Pups Save a Pluck-O-Matic / Pups Save a Mascot
Paw Patrol,Season 5,Ultimate Rescue: Pups Save a Runaway Stargazer
Paw Patrol,Season 5,Pups Save Ace's Birthday Surprise / Pups Save a Tower of Pizza
Paw Patrol,Season 6,Pups Save the Jungle Penguins / Pups Save a Freighter
Paw Patrol,Season 6,Ultimate Rescue: Pups Stop a Meltdown / Ultimate Rescue: Pups and the Mystery of the Missing Cell Phones
Paw Patrol,Season 6,Pups Save a Melon Festival / Pups Save a Cow
Paw Patrol,Season 6,Pups Save the Honey / Pups Save Mayor Goodway's Purse
Paw Patrol,Season 6,Ultimate Rescue: Pups Save the Mountain Climbers / Ultimate Rescue: Pups Save Captain Gordy
Paw Patrol,Season 6,Pups and the Stinky Bubble Trouble / Pups Save the Baby Ostriches
Paw Patrol,Season 6,Pups Save Gustavo's Guitar / Pups Save the Yoga Goats
Paw Patrol,Season 6,Pups Save Bedtime / Pups Save Chickaletta's Egg
Paw Patrol,Season 6,"Mighty Pups, Super Paws: When Super Kitties Attack"
Paw Patrol,Season 6,Pups Save a Manatee / Pups Save Breakfast
Paw Patrol,Season 6,Pups Save the Land Pirates / Pups Save the Birdwatching Turbots
Paw Patrol,Season 6,"Mighty Pups, Super Paws: Pups Meet the Mighty Twins"
Paw Patrol,Season 6,Pups Save a Freaky Pup-Day / Pups Save a Runaway Mayor
Paw Patrol,Season 6,Pups Save a Bat Family / Pups Save a Mud Monster
Paw Patrol,Season 6,"Mighty Pups, Super Paws: Pups Save a Giant Chicken / Mighty Pups, Super Paws: Pups Stop Harold's Deep Freeze"
Paw Patrol,Season 6,Pups Save the Balloon Pups / Pups Save the Spider Spies
Paw Patrol,Season 6,Pups Save the Bears / Pups Save a Farmerless Farm
Paw Patrol,Season 6,"Mighty Pups, Super Paws: Pups and the Big Twin Trick / Mighty Pups, Super Paws: Pups Save a Mega Mayor"
Paw Patrol,Season 6,Pups Save a White Wolf / Pups Save a Wrong Way Explorer
Paw Patrol,Season 6,Pups Save the Squirrels / Pups Save a Roo
Paw Patrol,Season 6,"Mighty Pups, Charged Up: Pups vs. the Copycat"
Paw Patrol,Season 6,Pups Save a Humsquatch / Pups Stop a Far Flung Flying Disc
Paw Patrol,Season 6,Pups Rescue a Rescuer / Pups Save the Phantom of the Frog Pond
Paw Patrol,Season 6,"Mighty Pups, Charged Up: Pups Stop a Big Bad Bot / Mighty Pups, Charged Up: Pups vs. the Dome"
Paw Patrol,Season 6,Ultimate Rescue: Pups Save the Opening Ceremonies / Ultimate Rescue: Pups Save the Adventure Bay Games
Paw Patrol,Season 6,Pups Save a Tour Bus / Pups Save Midnight at the Museum
Paw Patrol,Season 7,"Mighty Pups, Charged Up: Pups Stop a Humdinger Horde / Mighty Pups, Charged Up: Pups Save a Mighty Lighthouse"
Paw Patrol,Season 7,Pups Save Election Day / Pups Save the Bubble Monkeys
Paw Patrol,Season 7,Pups Save an Antarctic Martian / Pups Save the Maze Explorers
Paw Patrol,Season 7,"Mighty Pups, Charged Up: Pups vs. Three Super Baddies"
Paw Patrol,Season 7,Pups Save a Waiter Bot / Pups Stop a Pie-Clone
Paw Patrol,Season 7,Dino Rescue: Pups and the Lost Dino Eggs
Paw Patrol,Season 7,Dino Rescue: Pups Save a Pterodactyl / Dino Rescue: Pups and the Big Rumble
Paw Patrol,Season 7,Dino Rescue: Pups Save a Hum-Dino
Paw Patrol,Season 7,Dino Rescue: Pups Save a Sore Dino / Dino Rescue: Pups Save the Triceratops Tag-Alongs
Paw Patrol,Season 7,"Pups Save the Big Bad Bird Crew / Pups Save a Soapbox Derby"""
Paw Patrol,Season 7,Pups Save the Skydivers / Pups Save the Cupcakes
Paw Patrol,Season 7,Ultimate Rescue: Pups Save the Pupmobiles
Paw Patrol,Season 7,Pups Save a Lost Gold Miner / Pups Save Uncle Otis from His Cabin
Paw Patrol,Season 7,Pups Save a Rocket Roller Skater / Pups Save Ryder's Surprise
Paw Patrol,Season 7,Pups Save the Marooned Mayors / Pups Save the Game Show
Paw Patrol,Season 7,Pups Save the Chalk Art / Pups Save the Hot Potato
Paw Patrol,Season 7,Pups Save a Bah Humdinger
Paw Patrol,Season 7,Pups Save Little Hairy / Pups Save a Kooky Climber
Paw Patrol,Season 7,Pups Save Queen Cluck-Cluck / Pups Save a Desert Flounder
Paw Patrol,Season 7,Moto Pups: Pups vs. the Ruff-Ruff Pack
Paw Patrol,Season 7,Pups Save a Trash-dinger / Pups Save the Royal Armor
Paw Patrol,Season 7,Moto Pups: Pups Save the Donuts / Moto Pups: Pups Save the Kitties
Paw Patrol,Season 7,Moto Pups: Pups Save a Moto Mayor
Paw Patrol,Season 7,Moto Pups: Rescue at Twisty Top Mesa / Moto Pups: Pups Save a Sneezy Chase
Paw Patrol,Season 7,Ultimate Rescue: Pups Stop a Junk-Monster / Pups Save the Whale Pod
Paw Patrol,Season 7,Pups Save Thundermouth / Pups Save a Class Pet
Paw Patrol,Season 8,Pups Save a Runaway Rooster / Pups Save a Snowbound Cow
Paw Patrol,Season 8,Pups Save a Sweet Mayor / Pups Save a Magic Trick
Paw Patrol,Season 8,Pups Save a Rubble-Double / Pups Save a Clown
Paw Patrol,Season 8,Pups Stop the Cheetah
Paw Patrol,Season 8,Pups Save the Mustache / Pups Save the Funhouse
Paw Patrol,Season 8,Sea Patrol: Pups Save a Water Walker / Sea Patrol: Pups Save a Windsurfer
Paw Patrol,Season 8,Pups Save the Hiding Elephants / Pups Save a Yodeler
Paw Patrol,Season 8,Pups Save the Dizzy Dust Express / Pups Save the Treetop Trekkers
Paw Patrol,Season 8,Pups Save the Treasure Cruise / Pups Save Rocket Ryder
Paw Patrol,Season 8,Pups and Katie Stop the Barking Kitty Crew / Pups Save the Glasses
Paw Patrol,Season 8,Pups vs. a Neon Humdinger / Pups Save a Royal Painting
Paw Patrol,Season 8,Pups Save a Chicken Tulip / Pups Stop an Xtreme Shark
Paw Patrol,Season 8,Pups Save a Show Jumper / Pups Save the Salmon
Paw Patrol,Season 8,Pups vs. Ouchy Paws / Pups Save a Glow-in-the-Dark-Party
Paw Patrol,Season 8,Rescue Knights: Quest for the Dragon's Tooth
Paw Patrol,Season 8,Pups Stop a Super Shaker / Pups Save a Flying Farmhouse
Paw Patrol,Season 8,Pups Save a Box Fort / Pups Save Travelin' Travis from Really Big Bill!
Paw Patrol,Season 8,Rescue Knights: Pups Save a Dozing Dragon
Paw Patrol,Season 8,Rescue Knights: Pups Save a Tournament / Rescue Knights: Pups Save the Baby Dragons
Paw Patrol,Season 8,Rescue Knights: Pups Break the Ice / Rescue Knights: Pups Save Excalibark
Paw Patrol,Season 8,Dancing with Luke Stars / Pups Save a Mischievous Octopus
Paw Patrol,Season 8,Pups Save the Kitties and the Kiddies / Pups Save a Greenhouse
Paw Patrol,Season 8,Pups Save the Floating Goodways / Pups Save the Portable Pet Wash
Paw Patrol,Season 8,Pups Save a Lonesome Walrus / Pups Save the Hummy Gummies